{
  "number": 113,
  "name_arabic": "الفلق",
  "name_english": "Al-Falaq",
  "name_translation": "The Daybreak",
  "revelation_type": "Meccan",
  "total_verses": 5,
  "bismillah_pre": true,
  "verses": [
    {
      "number": 6226,
      "number_in_surah": 1,
      "juz": 30,
      "page": 604,
      "text_uthmani": "قُلْ أَعُوذُ بِرَبِّ الْفَلَقِ",
      "text_simple": "قل أعوذ برب الفلق",
      "translation_en": "Say, I seek refuge in the Lord of daybreak",
      "audio_url": "https://cdn.islamic.network/quran/audio/128/ar.alafasy/6226.mp3"
    },
    {
      "number": 6227,
      "number_in_surah": 2,
      "juz": 30,
      "page": 604,
      "text_uthmani": "مِن شَرِّ مَا خَلَقَ",
      "text_simple": "من شر ما خلق",
      "translation_en": "From the evil of that which He created",
      "audio_url": "https://cdn.islamic.network/quran/audio/128/ar.alafasy/6227.mp3"
    },
    {
      "number": 6228,
      "number_in_surah": 3,
      "juz": 30,
      "page": 604,
      "text_uthmani": "وَمِن شَرِّ غَاسِقٍ إِذَا وَقَبَ",
      "text_simple": "ومن شر غاسق إذا وقب",
      "translation_en": "And from the evil of darkness when it settles",
      "audio_url": "https://cdn.islamic.network/quran/audio/128/ar.alafasy/6228.mp3"
    },
    {
      "number": 6229,
      "number_in_surah": 4,
      "juz": 30,
      "page": 604,
      "text_uthmani": "وَمِن شَرِّ النَّفَّاثَاتِ فِي الْعُقَدِ",
      "text_simple": "ومن شر النفاثات في العقد",
      "translation_en": "And from the evil of the blowers in knots",
      "audio_url": "https://cdn.islamic.network/quran/audio/128/ar.alafasy/6229.mp3"
    },
    {
      "number": 6230,
      "number_in_surah": 5,
      "juz": 30,
      "page": 604,
      "text_uthmani": "وَمِن شَرِّ حَاسِدٍ إِذَا حَسَدَ",
      "text_simple": "ومن شر حاسد إذا حسد",
      "translation_en": "And from the evil of an envier when he envies.",
      "audio_url": "https://cdn.islamic.network/quran/audio/128/ar.alafasy/6230.mp3"
    }
  ]
}